{
  "schemaVersion": 1,
  "collectorVersion": "0.1.0",
  "tool": "npuir2ascendc-generate.py",
  "compiler": {
    "name": "npuir2ascendc",
    "version": "local"
  },
  "target": {
    "backend": "ascendc",
    "platform": "ascend-910b"
  },
  "capture": {
    "ir": "artifact",
    "metrics": true,
    "timing": false
  },
  "input": "samples/rmsnorm_residual_cast/case_001/raw/fused_dual_residual_rmsnorm_kernel.ttadapter.mlir",
  "pipeline": "load-captured-ttadapter-ir -> select-supported-function -> generate-ascendc-artifacts",
  "command": "python generate.py --input samples/rmsnorm_residual_cast/case_001/raw/fused_dual_residual_rmsnorm_kernel.ttadapter.mlir --out sample-traces/artifacts/real-triton-npu-dual-rmsnorm",
  "diagnostics": "Real local npuir2ascendc run completed successfully for fused_dual_residual_rmsnorm_kernel.",
  "stages": [
    {
      "index": 0,
      "pass": "load-captured-ttadapter-ir",
      "argument": "load-captured-ttadapter-ir",
      "opName": "builtin.module",
      "symbol": "@fused_dual_residual_rmsnorm_kernel",
      "scope": "builtin.module",
      "changed": false,
      "status": "ok",
      "verifier": "ok",
      "artifacts": {
        "beforePath": "artifacts/real-triton-npu-dual-rmsnorm/captured.ttadapter.mlir",
        "afterPath": "artifacts/real-triton-npu-dual-rmsnorm/captured.ttadapter.mlir"
      },
      "metricsBefore": {
        "lines": 85,
        "ops": 87,
        "fallback.count": 0,
        "strict.violations": 0,
        "unproven.tile_size": 0,
        "func.func": 1,
        "tt.divisibility": 6,
        "tt.shape_0": 1,
        "tt.shape_1": 1,
        "tt.shape_2": 1,
        "tt.shape_3": 1,
        "arith.constant": 5,
        "tensor.empty": 2,
        "linalg.fill": 12,
        "arith.muli": 1,
        "arith.index_cast": 1,
        "memref.reinterpret_cast": 6,
        "memref.alloc": 4,
        "memref.copy": 4,
        "bufferization.to_tensor": 4,
        "arith.extf": 4,
        "arith.mulf": 4,
        "bufferization.alloc_tensor": 2,
        "linalg.reduce": 2,
        "arith.addf": 5,
        "linalg.yield": 2,
        "tensor.extract": 8,
        "arith.divf": 4,
        "math.sqrt": 2,
        "arith.truncf": 2,
        "bufferization.materialize_in_destination": 2
      },
      "metricsAfter": {
        "lines": 85,
        "ops": 87,
        "fallback.count": 0,
        "strict.violations": 0,
        "unproven.tile_size": 0,
        "func.func": 1,
        "tt.divisibility": 6,
        "tt.shape_0": 1,
        "tt.shape_1": 1,
        "tt.shape_2": 1,
        "tt.shape_3": 1,
        "arith.constant": 5,
        "tensor.empty": 2,
        "linalg.fill": 12,
        "arith.muli": 1,
        "arith.index_cast": 1,
        "memref.reinterpret_cast": 6,
        "memref.alloc": 4,
        "memref.copy": 4,
        "bufferization.to_tensor": 4,
        "arith.extf": 4,
        "arith.mulf": 4,
        "bufferization.alloc_tensor": 2,
        "linalg.reduce": 2,
        "arith.addf": 5,
        "linalg.yield": 2,
        "tensor.extract": 8,
        "arith.divf": 4,
        "math.sqrt": 2,
        "arith.truncf": 2,
        "bufferization.materialize_in_destination": 2
      }
    },
    {
      "index": 1,
      "pass": "select-supported-function",
      "argument": "select-supported-function",
      "opName": "func.func",
      "symbol": "@fused_dual_residual_rmsnorm_kernel",
      "scope": "func.func @fused_dual_residual_rmsnorm_kernel",
      "changed": true,
      "status": "changed",
      "verifier": "ok",
      "artifacts": {
        "beforePath": "artifacts/real-triton-npu-dual-rmsnorm/captured.ttadapter.mlir",
        "afterPath": "artifacts/real-triton-npu-dual-rmsnorm/selected_function.ttadapter.mlir",
        "diagnosticsPath": "artifacts/real-triton-npu-dual-rmsnorm/diagnostics.txt"
      },
      "metricsBefore": {
        "lines": 85,
        "ops": 87,
        "fallback.count": 0,
        "strict.violations": 0,
        "unproven.tile_size": 0,
        "func.func": 1,
        "tt.divisibility": 6,
        "tt.shape_0": 1,
        "tt.shape_1": 1,
        "tt.shape_2": 1,
        "tt.shape_3": 1,
        "arith.constant": 5,
        "tensor.empty": 2,
        "linalg.fill": 12,
        "arith.muli": 1,
        "arith.index_cast": 1,
        "memref.reinterpret_cast": 6,
        "memref.alloc": 4,
        "memref.copy": 4,
        "bufferization.to_tensor": 4,
        "arith.extf": 4,
        "arith.mulf": 4,
        "bufferization.alloc_tensor": 2,
        "linalg.reduce": 2,
        "arith.addf": 5,
        "linalg.yield": 2,
        "tensor.extract": 8,
        "arith.divf": 4,
        "math.sqrt": 2,
        "arith.truncf": 2,
        "bufferization.materialize_in_destination": 2
      },
      "metricsAfter": {
        "lines": 85,
        "ops": 87,
        "fallback.count": 0,
        "strict.violations": 0,
        "unproven.tile_size": 0,
        "func.func": 1,
        "tt.divisibility": 6,
        "tt.shape_0": 1,
        "tt.shape_1": 1,
        "tt.shape_2": 1,
        "tt.shape_3": 1,
        "arith.constant": 5,
        "tensor.empty": 2,
        "linalg.fill": 12,
        "arith.muli": 1,
        "arith.index_cast": 1,
        "memref.reinterpret_cast": 6,
        "memref.alloc": 4,
        "memref.copy": 4,
        "bufferization.to_tensor": 4,
        "arith.extf": 4,
        "arith.mulf": 4,
        "bufferization.alloc_tensor": 2,
        "linalg.reduce": 2,
        "arith.addf": 5,
        "linalg.yield": 2,
        "tensor.extract": 8,
        "arith.divf": 4,
        "math.sqrt": 2,
        "arith.truncf": 2,
        "bufferization.materialize_in_destination": 2
      }
    },
    {
      "index": 2,
      "pass": "generate-ascendc-artifacts",
      "argument": "generate-ascendc-artifacts",
      "opName": "kernel_ir.module",
      "symbol": "@fused_dual_residual_rmsnorm_kernel_rmsnorm_residual_cast",
      "scope": "kernel_ir.module @fused_dual_residual_rmsnorm_kernel_rmsnorm_residual_cast",
      "changed": true,
      "status": "changed",
      "verifier": "ok",
      "artifacts": {
        "beforePath": "artifacts/real-triton-npu-dual-rmsnorm/selected_function.ttadapter.mlir",
        "afterPath": "artifacts/real-triton-npu-dual-rmsnorm/kernel.cpp",
        "diagnosticsPath": "artifacts/real-triton-npu-dual-rmsnorm/diagnostics.txt"
      },
      "metricsBefore": {
        "lines": 85,
        "ops": 87,
        "fallback.count": 0,
        "strict.violations": 0,
        "unproven.tile_size": 0,
        "func.func": 1,
        "tt.divisibility": 6,
        "tt.shape_0": 1,
        "tt.shape_1": 1,
        "tt.shape_2": 1,
        "tt.shape_3": 1,
        "arith.constant": 5,
        "tensor.empty": 2,
        "linalg.fill": 12,
        "arith.muli": 1,
        "arith.index_cast": 1,
        "memref.reinterpret_cast": 6,
        "memref.alloc": 4,
        "memref.copy": 4,
        "bufferization.to_tensor": 4,
        "arith.extf": 4,
        "arith.mulf": 4,
        "bufferization.alloc_tensor": 2,
        "linalg.reduce": 2,
        "arith.addf": 5,
        "linalg.yield": 2,
        "tensor.extract": 8,
        "arith.divf": 4,
        "math.sqrt": 2,
        "arith.truncf": 2,
        "bufferization.materialize_in_destination": 2
      },
      "metricsAfter": {
        "lines": 87,
        "ops": 40,
        "fallback.count": 0,
        "strict.violations": 0,
        "unproven.tile_size": 0,
        "ac.datacopy": 0,
        "ac.local.alloc": 0,
        "ub.live.slots.max": 1,
        "queue.depth": 1,
        "tile_size": 128,
        "tensor.count": 7,
        "source.anchors": 77
      }
    }
  ]
}
